{
  "schemaVersion": 1,
  "lastReviewed": "2026-10-08",
  "windowsBinarySources": [
    {
      "provider": "PostGIS / OSGeo Windows bundle",
      "type": "upstream-official",
      "url": "https://postgis.net/documentation/getting_started/install_windows/released_versions/",
      "availability": "public",
      "postgresqlDistribution": "standard-postgresql",
      "compatibility": "standard-postgresql",
      "notes": "PostGIS 3.6.2 bundle lists pgRouting 4.0.1; verify exact PG major and included subpackage."
    }
  ],
  "name": "pgrouting",
  "displayName": "pgRouting",
  "description": "Network routing extension",
  "upstreamRepository": "pgRouting/pgrouting",
  "status": "not-planned",
  "reasonCode": "existing-windows-distribution",
  "notPlannedReason": "Published PostGIS Windows bundles include pgRouting; building overlapping native GIS toolchains adds little value.",
  "evidenceUrls": [
    "https://github.com/pgRouting/pgrouting"
  ]
}
