{
  "schemaVersion": 1,
  "name": "pgtap",
  "displayName": "pgTAP",
  "description": "TAP-compatible PostgreSQL unit testing",
  "upstreamRepository": "theory/pgtap",
  "status": "implemented",
  "pgextwinCatalogName": "pgtap",
  "lastReviewed": "2026-10-22",
  "evidenceUrls": [
    "https://github.com/pgextwin/pgtap/releases/tag/v1.3.4-windows.1",
    "https://github.com/theory/pgtap"
  ],
  "windowsBinarySources": []
}
