{
  "schemaVersion": 1,
  "lastReviewed": "2026-10-08",
  "windowsBinarySources": [
    {
      "provider": "SRA OSS PostgreSQL support service",
      "type": "vendor",
      "url": "https://www.sraoss.co.jp/prod_serv/support/pgsql-mainte/",
      "availability": "support-customer",
      "postgresqlDistribution": "standard-postgresql",
      "compatibility": "manual-verification-required",
      "notes": "Windows binaries provided to support-contract customers, not public downloads. Request the exact PostgreSQL major/version from SRA OSS."
    }
  ],
  "name": "pg_repack",
  "displayName": "pg_repack",
  "description": "Online relation reorganization",
  "upstreamRepository": "reorg/pg_repack",
  "status": "implemented",
  "pgextwinCatalogName": "pg_repack",
  "evidenceUrls": [
    "https://github.com/pgextwin/pg_repack/releases",
    "https://www.sraoss.co.jp/prod_serv/support/pgsql-mainte/third-party-software-list/"
  ]
}
